"klasifikasi","x"
"Netral","eh nek awak due informasi vaksin sinovac dosis kabar tulungg makasoyy"
"Netral","akuu vaksin pfizerbiontech kalautidak pakai sinovac gapapa banget inti j"
"Positif","validasi sinovac who bukti vaksin aman ruji mutu vaksin pulih nusantara"
"Positif","validasi sinovac who bukti vaksin aman ruji mutu vaksin pulih indonesia"
"Positif","validasi sinovac who bukti vaksin aman ruji mutu vaksin indonesia ruji keamanann"
"Positif","vaksin kali kena c word gejala ringan untung pas pakai vaksin sinovac gampang l"
"Netral","tidak cuman apa jenis vaksin nya kek nya gejala efek nya nya"
"Positif","jbrfess informasi vaksin laksana kodim balai desa sukorambi sasar"
"Positif","ktp ku wonosobo vaksin nng depok sinovac seifikat aman"
"Netral","iyaaa sinovac kabar dapet vaksin booster kal"
"Negatif","australia buka pintu lancong lengkap vaksin sinovac astrazeneca austra"
"Netral","buka jangka"
"Positif","pemerintah arab saudi aku guna vaksin sinovac jamaah umroh indonesia"
"Positif","vaksin benar benar tidak ngaruh pakai vaksin sinovac"
"Netral","efikasi vaksin sinovac indonesia turun persen persen vaksin booster jenis vaksin covi"
"Positif","vaksin dspetnya sinovac pupu astrazeneca"
"Negatif","ku demam vaksin dosis ama kalauaku pakai sinovac tidak efek pas dosis ama"
"Netral","rapopo vaksin sinovac timbang astrazeneca daihatsu opo moderna modarne"
"Negatif","iyaaa beneran tidak asa kepengen tidur banget standa ngomong ngomong pakai sinovac vaksin nya"
"Positif","validasi sinovac who bukti vaksin aman ruji mutu vaksin pulih bangsa"
"Negatif","nyobain astrazeneca kali astrazeneca kali pfizer vaksin sinovac kali sinovac kali moderna"
"Positif","hooh mknya tidak vaksin astrazeneca pindah sinovac alhamdulillah tidak cmn pegal ditgn pas"
"Positif","vaksin nusantara nobuka pabrik vaksin sinovac laku ketua tim cinta produk indonesia"
"Positif","sih sinovac vaksin ama vaksin dosis ama k"
"Negatif","seng vaksin e sinovac ra sok keras kyo ngene astreav"
"Positif","vaksin sinovac vaksin moderna kalaua"
"Netral","sinovac suruh vaksin dokter nya"
"Positif","jenis vaksin i tau ku vaksin sinovac sakit"
"Positif","yeay terima vaksin sinovac masuk australia baca lengkap"
"Netral","nihhh vaksin sinovac pribadi tidak samsek rada pegal tidak ganggu ngant"
"Netral","gin gin udah vaksin jenis sinovac bawah"
"Positif","vaksin sinovac ngantuk tidak ilang"
"Positif","siswa sman sragen jalan vaksinasi covid vaksinasi laksana"
"Netral","kkm lulus syarat guna vaksin coronavac keluar sinovac remaja"
"Positif","stok dikemaskini kuantiti jenis keychain guyyss jenis rm jer keychain vaksin"
"Positif","iya pakai vaksin sinovac tidak kena asma izin vaksin"
"Netral","informasi jadwal vaksin serpong kota tangerang dosis sinovac"
"Netral","sinovac aman pas moderna abis sakit tidak vaksin pas vaksin sinovac in"
"Netral","waris mesti benar masuk anak suntik pasti tiada silap jenis vaksin b"
"Netral","eh zahwa no minor kaya bukan sinovac vaksin sekolah"
"Netral","gapapa jarak vaksin at least sinovac jarak"
"Netral","jenis vaksin sinovac"
"Netral","adik ku ngatain lemah demam pasca vaksin vaksin tidak napa anj beda vaksin"
"Netral","asli"
"Positif","validasi sinovac who bukti vaksin aman ruji mutu vaksin pulih nusantara"
"Positif","waah mantaabb nit alhamdulillah udah vaksin ama sept sinovac dapet pfizer terminal"
"Positif","pemerintah arab saudi aku guna vaksin sinovac jamaah umroh indonesia"
"Positif","akuu asma ambil sinovac jujur vaksin ama vaksin dada kaya b"
"Positif","sayang koleksi data bukti"
"Positif","asma vaksin ka asma bbrp sempet kumat kon"
"Positif","sumpah vaksin sd sakit vaksin sd vaksin demam pas vaksin"
"Negatif","nyari vaksin astrazeneca zeneca susah banget nemu moderna sinovac"
"Netral","vaksin pakai sinovac"
"Positif","jog informasi vaksin dosis bebas tidak domisili tidak masalahin vaksin mana sinovac"
"Positif","mama asma vaksin kak mending vaksin sinovac ringan moderna"
"Positif","otw vaksin alhamdulillah tidak jadi ayo belum vaksin vak"
"Positif","mjb tau ku kalaukita vaksin pergi ln vaksin indonesia tidak list ne"
"Negatif","rasain pas vaksin sinovac nyeri memar"
"Netral","alami reaksi pemantauan b"
"Positif","vaksin pulih nusantara vaksin ruji khasiat tingkat imunitas"
"Positif","ayo vaksin temen sinovac ngantuk laperan doang beneran deh"
"Netral","vaksin sinovac"
"Netral","minimal vaksin astrazeneca moderna kalauvaksinnya sinovac skip"
"Netral","adekku tim sinovac abis vaksin langsung nyuci piring jemur baju tidak asa"
"Netral","sinovac yah cmn kali vaksin"
"Netral","ayo besok vaksin du jenis vaksin sinovac pfizer informasi lengkap kontak yodi cc"
"Positif","h terbang medanbatam syarat vaksin kali sinovac booster moderna terima kasih"
"Netral","cah informasi vaksin sinovac dosis makasih"
"Netral","asli d"
"Netral","asli dar"
"Netral","asl"
"Netral","kalauvaksin nyo pakai astrazeneca jaraknyo kalausinovac jaraknyo"
"Netral","informasi vaksin sinovac dosis dongss"
"Netral","informasi vaksin sinovac mustika jaya bantu repost"
"Netral","informasi vaksin sinovac mustika jaya bantu repost"
"Positif","vaksin pulih nusantara validasi sinovac who bukti vaksin aman ruji mutu"
"Netral","nyesel vaksin astrazeneca sinovac"
"Positif","jamin halal vaksin sinovac"
"Negatif","abah kali ve no simptom from day till day ayep ama je sakit badan xlarat dem"
"Positif","dosis vaksin sinovac laksana vaksin covid pmi kabupaten sragen rab"
"Positif","menteri sehat malaysia menyetujui guna syarat vaksin covid buat sinovac china anak"
"Netral","tidak efek nya sih pusing gara lapar kaya vaksin sinovac ngomong ngomong"
"Negatif","problem immigration policynya saudi kang utama jab sinovac h"
"Netral","kodim sleman selesa vaksinasi dosis sasar sleman komando distrik mil"
"Negatif","vaksin varian sinovac ngerasa"
"Negatif","aikel popular arwah abam tinggal dunia gadis"
"Netral","adakan vaksin vaksin gelombang sinovac"
"Netral","sinovac vaksin nama sinopec mav jangan gas newbie"
"Netral","ltinfo vaksin dinkes kota tegalgt sinopharm moderna dosis sinovac dosis"
"Netral","tf informasi vaksin sinovac besok ktp non tegal gais kalaudinkes"
"Positif","vaksinasi psi kota depok solidaritas vaksin psi kota depok vaksin sinovac dosis syarat warga indonesia"
"Negatif","deket rumah gapapa nder kalaukm sinovac vaksin kalauvariannya gapapa"
"Negatif","sinovac remaja benar kp kesihatan"
"Positif","sih ribet vaksin sih selaen vaksin covid dibombardis vaksin bcg kali kali campak"
"Positif","vaksin nder sinovac iya laper ngantuk"
"Positif","vaksin ve sinovac aman"
"Netral","efek vaksin sinovac rasa ngantukan ttapi k ngantukan in"
"Netral","alhamdulilah vaksin sinovac kali"
"Netral","ketua arah kesihatan noor hisham abdullah vaksin covid lulus p"
"Negatif","upaya pemerintah tanggulang pandemi covid distribusi vaksin sinovac titik"
"Negatif","sing vaksin e sinovac ra sok keraskyo ngene loh astreav"
"Netral","anak laki th ponpes ekselencia parung cuman nyata positif antigen"
"Negatif","hallo vaksin dosis sinovac vaksin ulang guna"
"Negatif","orang tua vaksin kena covid mele"
"Netral","rapopo vaksin sinovac timbang astrazeneca daihatsu opo moderna modarne"
"Positif","untumg tidak vaksin info sinovac tidak maren badan tidak fit"
"Netral","ayo besok vaksin du jenis vaksin sinovac pfizer informasi lengkap kontak yodi cc"
"Netral","vaksin sinovac lulus remaja usia via"
"Netral","personil polsek cimanggis ayan lansia suntik vaksin sinovac"
"Positif","hasil vaksin sinovac"
"Negatif","am china sumbang juta dosis vaksin sinovac malaysia read more"
"Netral","uda vaksin sinovac kali booster pakai moderna"
"Positif","temen asma udah vaksin sinovac aman asma baik sgr vaksin temen"
"Positif","ndes vaksin ama vaksin langsung auditorium unnes sekar jenis vaksin"
"Netral","kkm lulus vaksin sinovac remaja via"
"Netral","kkm lulus syarat guna vaksin coronavac keluar sinovac remaja"
"Netral","vaksin sinovac wkwkwkwkk dapet sisa kuota dosis kampus barusan banget"
"Positif","kuasa kawal dadah pbkd tuju kelulus syarat guna vaksin coronavac keluar sinovac l"
"Netral","cah informasi vaksin d sinovac"
"Netral","efikasi vaksin sinovac indonesia turun persen persen vaksin booster jenis vaksin c"
"Positif","informasi vaksin banjarmasin informasi puskesmas kapur raya banjarmasin besok vaksin sinovac l"
"Positif","ndes vaksin ama vaksin langsung auditorium unnes sekar jenis v"
"Netral","teknoloji mrna punya kesan samping kuat suai golong komorbiditi sinovac l"
"Positif","tidak perluuuu kalauvaksin bawa ktp vaksin jenis vaksin sinovac"
"Netral","pokok jarak vaksin sinovac astrazeneca"
"Negatif","feeling engkuk masuk kabupaten s iki ng malang"
"Netral","vaksin semarang jenis sinovac"
"Positif","informasi vaksin banjarmasin informasi puskesmas kapur raya banjarmasin besok vaksin sinovac bi"
"Netral","ko seremm vaksin sinovac"
"Positif","australia izin vaksin sinovac covishield syarat masuk a jalan internasional"
"Netral","vaksin sinovac lulus remaja usia via"
"Positif","attention korang yassss its resmi vaksin sinovac kat remaja umur"
"Positif","baik vaksin lengkap negara arab saudi terima vaksin sinovac"
"Negatif","juru bicara vaksinasi covid siti nadia tarmizi tanggap isu turun efikasi vaksin sinovac pasca"
"Negatif","remaja usia benar ambil vaksin jenis sinovac lepas kelulus kkm"
"Netral","jog informasi vaksin dosis sinovac dosis d jogja jadwal dosis nya besok"
"Netral","lokasi vaksin covid sinovac gratis solo"
"Negatif","juru bicara vaksinasi covid siti nadia tarmizi tanggap isu turun efikasi vaksin sinovac p"
"Netral","kkm lulus vaksin sinovac remaja"
"Positif","guna vaksin keluar kalangan usia utama remaja"
"Positif","anak udah tiket vaksin app tidak mana vaksin nya cek nya d"
"Positif","yogyakaa lapas narkotika kelas iia yogyakaa gelar vaksinasi merdeka tahap giat vaksinasi covid"
"Netral","rapopo vaksin sinovac timbang astrazeneca daihatsu opo moderna modarne"
"Netral","kelulus vaksin sinovac golong umur lepas mesyuarat kuasa kawala"
"Negatif","juru bicara vaksinasi covid siti nadia tarmizi tanggap isu turun efikasi vaksin sinovac pasca sun"
"Netral","jangan lupa ambil vaksin adikadik"
"Netral","raja lulus vaksin sinovac remaja"
"Negatif","sinovac dosis ajar smk dukuhturi suntik vaksin covid"
"Netral","kkm lulus guna vaksin coronavac keluar sinovac life sciences co ltd china golong usia terminal"
"Netral","daftar vaksin sinovac klinik polresta bandung jlbhayangkara soreang silahka"
"Netral","copid tidak jrx vaksin sinovac"
"Netral","vaksin pfizer sinovac bagus"
"Positif","ayo hadir gerai vaksin tni polri laksana"
"Positif","kkm bersetuju kelulus syarat guna vaksin coronavac keluar sinovac life scienc"
"Netral","umur tau udah vaksin kali tinggal"
"Netral","eitss vaksin sinovac langka"
"Negatif","remaja usia benar ambil vaksin jenis sinovac lepas kelulus kkm"
"Positif","insya allah aman rey abis vaksin sinovac reakainya ngantuk banget laperan banget"
"Negatif","pbkd sar guna sinovac kalangan remaja usia utama"
"Negatif","pbkd sar guna sinovac kalangan remaja usia"
"Negatif","imunisasi covid guna vaksin coronavac keluar sinovac life sciences co ltd china pharmaniaga life"
"Positif","walah sby kota moga dapet deh yak pas vaksin pakai pfizer"
"Netral","udah tetangga update vaksin sedia puskesmas dekat rumah sinovac"
"Negatif","efikasi vaksin sinovac indonesia turun persen persen vaksin booster jenis v"
"Negatif","wow lepas gomen approved sinovac budak orang booking beli vaksin anak"
"Netral","jangan lupa ambil vaksin adikadik"
"Positif","mesyuarat kuasa kawal dadah kelulus syarat guna vaksin keluar sinovac remaja be"
"Netral","ketua arah kesihatan tan sri noor hisham abdullah perkara dipersetujui mesyuarat kuasa k"
"Positif","ayo buru vaksin belum dosis pfizer dosis vaksin"
"Positif","belum vaksin dosis dosis lewat dosis sinovac astrazeneca zeneca t"
"Netral","kalauchip gin vaksin sih serius na mak kalausinovac kayak tidak deh"
"Negatif","informasi vaksin covid bogor sinovac dosis puskesmas nanggung"
"Netral","ketua arah kesihatan tan sri noor hisham abdullah perkara dipersetujui mesyuarat"
"Netral","sik vaksin sinovac rasah kancani"
"Negatif","menteri kesihatan malaysia kkm lulus guna coronavac keluar sinovac life science"
"Positif","u budiw babinsa koramil kemiri damping suntik vaksin sinovac tenaga sehat"
"Negatif","vaksin dosis done dosis sinovac dosis covid alami dosis moderna iship im comingggg"
"Negatif","update vaksin covid bogor sinovac dosis puskesmas nanggung anak usia"
"Netral","jangan sok keras vaksin nya sinovac vaksin jonivac suntik nya gede kenyal enak l"
"Positif","teman teman tugas wawancara kriteria belum vaksin sinovac"
"Netral","guna vaksin coronavac keluar sinovac life sciences co ltd china pharmaniaga lifesciences sdn bhd ma"
"Positif","ayo hadir gerai vaksin tni polri laksana"
"Netral","raja lulus guna vaksin sinovac remaja malaysianow"
"Positif","pbkd sar guna vaksin coronavac kalangan remaja usia d"
"Positif","bgr vaksinasi grastis warga bogor daftar online langsung dosis khu"
"Positif","bgr vaksinasi grastis warga bogor daftar online langsung dosis"
"Netral","adik adik jangan takut ambil vaksin kena gigit semut je"
"Negatif","guna vaksin sinovac golong remaja umur benar kp kesihatan sumber"
"Positif","maksimal vaksin ama kalausinovac moderna maksimal kalauastrazeneca"
"Positif","situbondo gencar semangat serbu vaksinasi covid dosis kodim situbondo jenis vaksin"
"Positif","iya benar emang efek vaksin sinovac laper"
"Netral","kkm lulus guna vaksin keluar sinovac remaja berita hari"
"Netral","mb docni rame d paksa vaksingmn mb doc bsok jdwal vaksi data sruh ngisi"
"Positif","pfizer vaksin utama program pick remaja vaksin sinovac ditawarkan re"
"Netral","informasi vaksin sinovac pfizer bogor puskesmas ciseeng dosis kuota"
"Positif","vaksin sinovac china indonesia vaksin sinopal"
"Positif","menteri kesihatan malaysia kkm bersetuju kelulus syarat guna vaksin coronavac k"
"Positif","kkm bersetuju kelulus syarat guna vaksin coronavac keluar sinovac life sciences co lt"
"Netral","ayo vaksin moderna dosis astrazeneca dosis sinovac dosis biddokkes polda kepri kepri"
"Netral","kali doo nk t cgu mksud lancau curious pon vaksin sinovac senng skit nk score nnti"
"Netral","vaksin keluar sinovac lulus remaja"
"Netral","kkm lulus vaksin sinovac remaja"
"Negatif","sinovac udah langsung belum seifikat vaksin nya"
"Positif","kini bersetuju kelulus syarat guna vaksin keluar sinovac life scie"
"Negatif","vaksin moderna takut after effectsnya sinovac kali"
"Positif","lulus vaksin remaja"
"Positif","tu janji budak sekolah nak vaksin dghisham cakap remaja"
"Positif","informasi jadwal lokasi vaksin sinovac garut gratis"
"Netral","informasi vaksin sinovac pfizer bogor puskesmas sukajaya masyarakat"
"Netral","kkm lulus guna vaksin keluar sinovac remaja"
"Netral","alhamdulillah lepas cucuk vaksin sinovac cari self reward"
"Negatif","guna vaksin sinovac golong remaja umur benar kp kesihatan"
"Negatif","guna vaksin sinovac golong remaja umur benar kp kesihatan"
"Netral","australia buka perbatasanpenerbangan internasional vaksin sinovac masuk oz kabar"
"Positif","sdf informasi vaksin sinovac rek vaksin soale belum jelas hikd"
"Negatif","guna vaksin sinovac golong remaja umur benar"
"Netral","awal vaksin covid personil satlantas polres ngada laksana aman awal vial vaksin"
"Positif","guna vaksin keluar kalangan usia utama kepa"
"Positif","st dose astrazeneca then aefi amik nd dose sinovacso abis cerita vaksin sbb mysejahtera sah"
"Positif","kmpanye hrus vaksin unjung pngadaan untung lgsitu tim riset marketingnya sinovac"
"Positif","kkm sar guna vaksin keluar sinovac remaja utama remaja"
"Netral","jenis vaksin sinovac sinopharm"
"Positif","vaksin kelulus syarat lepas guna cominay keluar pfizerbiontech"
"Negatif","guna vaksin sinovac golong remaja umur benar"
"Positif","vaksin besuk bebas non domisili sinovac"
"Positif","arab saudi tidak terima suntik vaksin sinovac"
"Negatif","informasi vaksin covid massal bogor camat tanjungsari pakai sinovac pfizer"
"Negatif","guna vaksin sinovac golong remaja umur benar"
"Positif","vaksin kelulus syarat lepas guna cominay keluar pfizerbiontech"
"Positif","kini bersetuju kelulus syarat guna vaksin keluar sinovac lif"
"Positif","buka kak syarat pei vaksin"
"Negatif","temen ku vaksin nya beda loh bukan sinovac malas jelasin nya ah"
"Netral","whatttt orang taiwan china gamau sinovacpiye iki makasih ka"
"Netral","nyata akhbar menteri kesihatan malaysia kuasa kawal dadah pbkd bermesyuarat me"
"Netral","w sinovac vaksin beda bedaa"
"Positif","kuasa kawal dadah pbkd tuju kelulus syarat guna vaksin coronavac keluar sinov"
"Netral","vaksin sinovac"
"Netral","aing vaksin ci nya sinovac"
"Negatif","syarat vaksin covid bogor sinovac puskesmas cangkurawok besok cek info"
"Positif","butuh booster a suntik vaksin coba kelinci kitakita"
"Positif","ayo hadir gerai vaksin tni polri laksana w"
"Positif","kak maaf orang taiwan vaksin sinovac tidak"
"Positif","siswa smk islam jumo vaksin dosis babinsa koramil kedungjati u sugiyanto bhabinkamtibmas monitor"
"Netral","vaksin sinovac kurang lampau butuh booster kah malaysia mel"
"Positif","vaksinasi psi kota depok solidaritas vaksin psi kota depok vaksin sinovac dosis syarat warga in"
"Negatif","update vaksin covid bogor sinovac puskesmas cangkurawok kuota"
"Netral","sinovac yakkum bareng lansia gara otg nunggu informasi baru kalauskrg positif"
"Positif","giat vaksinasi massal masyarakat brebes gerai vaksin presisi polres brebes dosis ama d"
"Negatif","informasi vaksin covid bogor puskesmas caringin pakai sinovac pfizer kuota"
"Positif","sila daftar link sedia kuota formulir otomatis teutup"
"Positif","kapolres brebes akbp faisal febrianto sik monitoring laksana giat vaksinasi mass"
"Negatif","rumah sakit akademik ugm buka tenda vaksin gedung utara kuota vaksin sinovac dosis"
"Netral","uaf teman mana vaksin sinovac"
"Negatif","titik lokasi laksana vaksin covid bogor puskesmas pasar rebo pakai sinovac pfizer"
"Positif","jog informasi vaksin sinovac dosis udah vaksin dosis jogja gaes makasih banget"
"Negatif","update informasi vaksin covid bogor puskesmas leuwisadeng pakai sinovac"
"Netral","vaksin seling gaboleh kayak dosis sinovac dosis astrazeneca zeneca"
"Positif","panjang kanggo kancakanca brebes l sekitare vaksinasi usia kuo"
"Positif","validasi sinovac who bukti vaksin aman ruji mutu vaksin sembuh bangsa"
"Netral","daftar vaksin sinovac klinik polresta bandung jlbhayangkara soreang sil"
"Positif","usia kena covid alhamdulillah pulih"
"Negatif","anw vaksin ama pegal lebam cuy sinovac"
"Positif","sing vaksin e moderna dipadakne gendaanmu sing vaksin e gur sinovac yo tidak mlipir no sayang xixi"
"Positif","sayang skli tidak join babeh aldo behsdh tanyakah bhw jk vaksin"
"Netral","kalauseifnya vaksin sinovac coba ngechat engkoh bantu nder"
"Positif","vaksin dapat sih sinovac efek tidak ngerasai apa kek o"
"Netral","vaksin sinovac suntik warga pakai astrazaneca"
"Positif","tapi booster merk vaksin pakai kali"
"Negatif","bingungin kalauvaksin sinovac china buat virus covid dimatikanberai"
"Netral","kanggo kancakanca brebes l sekitare laksana"
"Positif","ajar smp kabupaten pasuruan terima suntik vaksin sinovac"
"Positif","akibat amuk wargaterjadi rusak posko gerai vaksin vial vaksin dosis vial va"
"Netral","sd islamic center brebes vaksinasi"
"Netral","sd islamic center brebes vaksina"
"Negatif","suami tmn vaksin sinovac lengkap kena covid tinggal"
"Netral","nder vaksin sinovac saranin jangan pergi tubuhm"
"Netral","wkwkwkwkkw manifest nuker vaksin sinovac sianjing"
"Negatif","istri vaksin ama covid sinovac dokumentasi video youtube s"
"Negatif","kalauaku kmren dosis sinovac pegal ayo rada pusing abs vaksin langsung tidak"
"Netral","orang pfizer sinovac efek tidak oknum bilang habis vaksin sakit"
"Positif","kalaubelom vaksin pilih vaksin pilih pfizer tau effectivity r"
"Netral","jarak vaksin sinovac ama sih"
"Positif","mnku sinovacpfizer vaksin sih"
"Negatif","efek moderna kalausinovac vaksin moderna syarat pergi neger sinovac"
"Netral","panjang sd islamic center"
"Negatif","kena covid mas komorbid jantung stroke alhamdulilah baikb"
"Netral","koramil tng mngdkan vaksinasi dosis jenis sinovac hlm lurah cimone jaya rangka"
"Netral","wkwkw udahh vaksin sinovac suruh moderna nunggu kesiap hati"
"Negatif","yahhh ku sinovac vaksin sinovac pergi ln vaksin bukan sinovac"
"Positif","vaksin sembuh bangsa validasi sinovac who bukti vaksin aman ruji mutu"
"Netral","lur toloong informasi vaksin sinovac teman makasiih"
"Negatif","vaksin sinovac positif masuk rumah sakit"
"Netral","hahahah bokap lucu banget en vaksin sinovac moderna katane nyg ash remaja ueueueu gemeshh"
"Negatif","oyi vaksin sinovac dosis udah tiket pedulilindungi balas khusus dom mlg"
"Netral","lur fess informasi vaksin sinovac dosis solo"
"Negatif","malaysia bekerjasama syarikat bangun vaksin covid cansino sinovac bangun vaks"
"Negatif","vaksin sinovac sok keras astrazeneca bos senggol"
"Negatif","kena covid mas komorbid jantung stroke alhamdulila"
"Netral","asma tidak vaksin sinovac kah"
"Netral","informasi vaksin sinovac dosis dongg umsfess"
"Netral","informasi vaksin dosis sinovac bekas"
"Positif","surat edar hki kemenkes vaksinasi dosis tiga nakes gu"
"Negatif","vaksin sinovac lantas positif covid vaksin sinovac"
"Positif","informasi vaksin sinovac dosis kabupaten tangerang vaksin presisi gor bonang udah tidak huhu"
"Negatif","who belanda khusus aku vaksin sinovac seifikat dapat warga indonesia"
"Netral","hubung banyak seifikat orang indonesia cantum merk dagang vaksin sinovac coronava"
"Positif","vaksin pfizer astrazeneca wilayah mustika jaya sini puskesmas mustika jaya sedia vaks"
"Positif","data tahan sinovac vaksin belum umum terima vaksin"
"Negatif","kota surabaya vaksinasi gelar lapang thor kompleks gelora pancasila target dosis va"
"Netral","program tni al wakil komando lintas laut militer kolinlamil sedia vaksin sinovac"
"Netral","daftar vaksin sinovac klinik polresta bandung jlbhayangkara soreang"
"Netral","vaksin dosis ama sinovac biofarma seifikat diprint"
"Negatif","china sumbang juta dosis vaksin covid coronavac sinovac tambah malaysia dasar persaha"
"Positif","beempat puskesmas batang kabupaten pati laksana serbu vaksinasi dosis vaksin sinovac k"
"Positif","mjb tidak jadwal vaksin dosis sinovac bina sehat emng tidak tru"
"Positif","gantung vaksin nya apaa sih kalausinovac iya wkwkw ngantuk laper"
"Negatif","pfizer doang dipake indonesia sinovac astrazeneca beahannya"
"Negatif","aljazair resmi lini produksi vaksin covid sinovac"
"Netral","kapolsek bulu akp banuari pantau cepat vaksin sinovac dosis i i sasar lansia a masyarakat"
"Netral","via vaksin sinovac dosis kaltim pos mall lembuswana link kalauada share ht"
"Negatif","china sumbang vaksin sinovac malaysia"
"Netral","berat yah minum air putih anyta dengar vaksin sinovac terminal"
"Negatif","china sumbang juta dosis vaksin covid coronavac sinovac tambah malaysia dasar pers"
"Positif","ayo hadir gerai vaksin tni polri laksana"
"Netral","ngasi orang pinter banget abis vaksin istirahat bupak jangan capek moderna e"
"Negatif","vaksin sinovac ngerasain pegal"
"Netral","smp neger kaliwungu vaksinasi rentak pesea didik tonton video jangan lupa subscribe like com"
"Netral","tt huhuuu thanks vaksin sinovac"
"Netral","vaksin sinovac dosis kaltim pos mall lembuswana link kalauada share"
"Netral","bhabinkamtibmas kalurahan ngawu bripka prima back up kanit provost aiptu parjiman sambang monitoring aksa"
"Netral","belum tingkat bor ind"
"Netral","dinkes kota kendari terima dosis vaksin sinovac buka layan"
"Positif","babinsa koramil enrekang melaksankan emantauan laksana serbu vaksin nasional pusk"
"Netral","informasi vaksin dosis jenis sinovac daerah tegal"
"Netral","via vaksin sinovac dosis kaltim pos mall lembuswana link kalauada share"
"Positif","raja bangun pelan strategik bangun vaksin negara umum perdana menteri"
"Netral","visa on arrival tidak nerima pakai vaksin sinovac fuck"
"Positif","halo sobat polri masyarakat ktp sekoharjo sapa belum vaksin klinik param"
"Netral","vaksin gtlt sinovac astrazeneca"
"Netral","vaksin sinovac dosis kaltim pos mall lembuswana link kalauada share"
"Netral","ajar ajibata parsoburan dapat vaksin sinovac dosis i"
"Positif","akang teteh sadayana punten informasi vaksin dosis ktp nya bukan bandung mana yah kalo"
"Positif","sasar vaksin dosis hari bhabinkamtibmas desa jatireja paping baping a relawan mela"
"Positif","akang teteh sadayana punten informasi vaksin dosis ktp nya bukan bandung mana yah"
"Netral","ynag sinovac moderna sinopharm habis ganti vaksin tidak"
"Netral","them boys still debating whether get asta sinovac pfizer kecuali medis tidak rekomendasi"
"Netral","emang vaksin beda beda ngasihnya sinovac iya efek pegal tang nyut nyut"
"Positif","horas medan urus daerah ikat alumni itb sumatera utara sentra vaksin bumn gelar laksana vak"
"Negatif","mjb kalausinovac enteng sih tang pegal vaksin astraz"
"Positif","akibat amuk wargaterjadi rusak posko gerai vaksin vial vaksin dosis v"
"Negatif","imunogenisitas vaksin sinovac turun persen ama kali suntik tubuh"
"Positif","yoben vaksin ee sinovac seivikat"
"Positif","ayo hadir gerai vaksin tnipolri dilakskan"
"Negatif","relevan video tambah pfizer moderna jabat percaya sinovac"
"Positif","laksana giat pam suntik vaksin vaksin jenis merek vaksin sinovac uptd puskesmas rantau"
"Positif","validasi sinovac who bukti vaksin aman ruji mutu"
"Positif","iyasih astrazeneca rem kantor vaksin astrazeneca jatah libur hari sinovac budak haha"
"Netral","beda vaksin sinovac astrazeneca informasi masyarakat daftar vaksin"
"Positif","hallo kuys belum vaksin lho vaksin rumah sakit uns dosis"
